{
  "$schema": "https://json-schema.org/draft/2020-12/schema",
  "$id": "https://github.com/moqtap/test-vectors/schema/codec-vector.schema.json",
  "title": "MoQT Codec Test Vector File",
  "description": "A collection of codec test vectors pairing hex-encoded wire bytes with expected decoded representations or errors.",
  "type": "object",
  "required": [
    "message_type",
    "vectors"
  ],
  "properties": {
    "$schema": {
      "type": "string"
    },
    "message_type": {
      "type": "string",
      "description": "The message type or codec unit being tested (e.g., 'varint', 'subscribe', 'client_setup')."
    },
    "message_type_id": {
      "type": "string",
      "pattern": "^0x[0-9a-f]+$",
      "description": "Hex-encoded message type ID from the wire format (e.g., '0x03' for SUBSCRIBE)."
    },
    "spec_section": {
      "type": "string",
      "description": "Reference to the specification section defining this message type (e.g., '9.7')."
    },
    "vectors": {
      "type": "array",
      "items": {
        "$ref": "#/$defs/vector"
      }
    }
  },
  "additionalProperties": false,
  "$defs": {
    "vector": {
      "type": "object",
      "required": [
        "id",
        "description",
        "hex"
      ],
      "properties": {
        "id": {
          "type": "string",
          "pattern": "^[a-z0-9-]+$",
          "description": "Unique identifier within the file. Kebab-case."
        },
        "description": {
          "type": "string",
          "description": "Human-readable description of what this case tests."
        },
        "hex": {
          "type": "string",
          "pattern": "^([0-9a-f]{2})+$",
          "description": "Lowercase hex-encoded wire bytes. No 0x prefix, no separators."
        },
        "decoded": {
          "type": "object",
          "description": "Expected decoded representation as a plain JSON object. Keys are the field names the draft gives, in the order it defines them. A field the message did not carry is absent rather than zero. Every Key-Value-Pair block — `parameters`, `setup_parameters`, `options`, `track_properties`, `track_extensions`, and on the data plane `extension_headers` and `object_properties` — is a list of entries; see `kvp_block`.",
          "properties": {
            "parameters": {
              "$ref": "#/$defs/kvp_block"
            },
            "setup_parameters": {
              "$ref": "#/$defs/kvp_block"
            },
            "options": {
              "$ref": "#/$defs/kvp_block"
            },
            "track_properties": {
              "$ref": "#/$defs/kvp_block"
            },
            "track_extensions": {
              "$ref": "#/$defs/kvp_block"
            },
            "extension_headers": {
              "$ref": "#/$defs/kvp_block"
            },
            "object_properties": {
              "$ref": "#/$defs/kvp_block"
            }
          }
        },
        "canonical": {
          "type": "boolean",
          "default": true,
          "description": "Defaults to true. Set to false for valid-but-non-canonical encodings (decode-only test)."
        },
        "error": {
          "type": "string",
          "enum": [
            "incomplete",
            "unknown_message",
            "invalid_type",
            "invalid_value",
            "invalid_parameter",
            "parameter_out_of_scope",
            "duplicate_parameter",
            "missing_parameter",
            "payload_not_permitted"
          ],
          "description": "Error category for invalid vectors. Names the kind of complaint a conforming decoder must make, not the specific error it raises: there is more than one defensible way to notice most of these, and a vector is evidence about the protocol rather than about a particular parser. incomplete: The frame ended early. Nothing about the bytes present is wrong; there are not enough of them. unknown_message: The frame begins with a type code this version assigns to nothing - a control message, a data stream or a datagram. invalid_type: The type code is inside the form the version defines and is one the version separately names as invalid, such as a reserved bit combination. Distinct from unknown_message, which is about a code no table assigns at all. invalid_value: A field holds a value the version does not allow it. invalid_parameter: A parameter is wrong in itself: its type, its length, its value's range, or its position in a delta-coded run. parameter_out_of_scope: A parameter is well formed and appears in a message its own definition does not name. Only versions that require a receiver to reject it use this; earlier ones say such a parameter is ignored, and there is nothing to assert. duplicate_parameter: A parameter type appears twice where the version forbids repeating it. missing_parameter: A parameter the message requires is absent. payload_not_permitted: An object carries a payload where its status or its framing leaves no room for one."
        },
        "error_detail": {
          "type": "string",
          "description": "Optional human-readable detail about the expected failure."
        },
        "profiles": {
          "type": "array",
          "items": {
            "type": "string",
            "enum": [
              "endpoint",
              "forwarder"
            ]
          },
          "minItems": 1,
          "uniqueItems": true,
          "description": "Which conformance profiles this vector's expectation binds. Omitted means both. 'endpoint' is a consumer bound by every rule the specification states for a receiver; 'forwarder' is one that carries bytes between endpoints and is bound only by what it must parse to find where a frame ends. A vector asserting that bytes MUST be refused can be true of the first and not of the second, and a corpus that cannot say so makes the second fail tests it was never meant to pass. A consumer runs the vectors naming its profile and should count what it leaves out rather than passing over it quietly: a profile is a claim about which rules apply, not a way to make a failing vector go away."
        }
      },
      "oneOf": [
        {
          "required": [
            "decoded"
          ],
          "not": {
            "required": [
              "error"
            ]
          }
        },
        {
          "required": [
            "error"
          ],
          "not": {
            "required": [
              "decoded"
            ]
          }
        }
      ],
      "additionalProperties": false
    },
    "kvp_entry": {
      "type": "object",
      "description": "One Key-Value-Pair, as it sat on the wire. A parameter block is an ordered list of (Type, Value) with the types ascending, and this corpus renders it as a list rather than as a map keyed by the draft's name for each type. A map loses three things a vector may need to state: a repeat, which two parameter definitions permit (AUTHORIZATION_TOKEN, and on drafts 19 and 20 the five Range Filters); the order, which drafts 16 and later answer a violation of with a session close; and a type the draft assigns no name, which has no key to sit under. As a list, each of those is an ordinary entry.",
      "required": [
        "type"
      ],
      "properties": {
        "type": {
          "type": "string",
          "pattern": "^0x[0-9a-f]+$",
          "description": "The Parameter Type, lowercase hex. Always present: it is what the wire carries, and it is enough to compare against without implementing this corpus's per-draft name table."
        },
        "name": {
          "type": "string",
          "description": "The name the draft gives this type, in snake_case. Absent when the draft assigns the type nothing, which is how an entry says the type is unknown to that version."
        },
        "value": {
          "description": "The decoded value, when this corpus models it: a decimal string for an integer, an object for a structure, a list of entries for a nested Key-Value-Pair block such as draft-20's FILL_PARAMETERS. Mutually exclusive with raw_hex."
        },
        "raw_hex": {
          "type": "string",
          "pattern": "^([0-9a-f]{2})*$",
          "description": "The value's bytes, when this corpus does not model them. Mutually exclusive with value. An unnamed *integer* parameter still uses value rather than this, because a varint's value is its content and there are no bytes to show."
        }
      },
      "additionalProperties": false,
      "oneOf": [
        {
          "required": [
            "value"
          ],
          "not": {
            "required": [
              "raw_hex"
            ]
          }
        },
        {
          "required": [
            "raw_hex"
          ],
          "not": {
            "required": [
              "value"
            ]
          }
        }
      ]
    },
    "kvp_block": {
      "type": "array",
      "description": "A Key-Value-Pair block, in the order the wire carried it. Empty when the message carried no parameters.",
      "items": {
        "$ref": "#/$defs/kvp_entry"
      }
    }
  }
}
