{
  "$schema": "../../../../schema/codec-vector.schema.json",
  "message_type": "object",
  "message_type_id": "0x01",
  "spec_section": "6.11",
  "vectors": [
    {
      "id": "normal-object",
      "description": "OBJECT_DATAGRAM with normal status (0) and payload",
      "hex": "01010200000000cafe",
      "decoded": {
        "subscribe_id": "1",
        "track_alias": "2",
        "group_id": "0",
        "object_id": "0",
        "object_send_order": "0",
        "object_status": "0",
        "payload_length": "2",
        "payload_hex": "cafe"
      }
    },
    {
      "id": "end-of-track",
      "description": "OBJECT_DATAGRAM carrying an EndOfTrackAndGroup marker at Group ID 1, one greater than the largest group produced, with Object ID 0, as Section 6.11.1.1 requires",
      "hex": "01010201000004",
      "decoded": {
        "subscribe_id": "1",
        "track_alias": "2",
        "group_id": "1",
        "object_id": "0",
        "object_send_order": "0",
        "object_status": "4",
        "payload_length": "0"
      }
    },
    {
      "id": "object-does-not-exist",
      "description": "OBJECT_DATAGRAM with ObjectDoesNotExist status (1), no payload",
      "hex": "01010200030001",
      "decoded": {
        "subscribe_id": "1",
        "track_alias": "2",
        "group_id": "0",
        "object_id": "3",
        "object_send_order": "0",
        "object_status": "1",
        "payload_length": "0"
      }
    },
    {
      "id": "group-does-not-exist",
      "description": "OBJECT_DATAGRAM with GroupDoesNotExist status (2), no payload",
      "hex": "01010205000002",
      "decoded": {
        "subscribe_id": "1",
        "track_alias": "2",
        "group_id": "5",
        "object_id": "0",
        "object_send_order": "0",
        "object_status": "2",
        "payload_length": "0"
      }
    },
    {
      "id": "truncated",
      "description": "truncated OBJECT_DATAGRAM — missing track_alias",
      "hex": "0101",
      "error": "incomplete",
      "error_detail": "unexpected end of input while reading track_alias"
    }
  ]
}
