{
  "$schema": "../../../../schema/codec-vector.schema.json",
  "message_type": "subscribe_request",
  "message_type_id": "0x03",
  "spec_section": "6.3",
  "vectors": [
    {
      "id": "minimal",
      "description": "SUBSCRIBE REQUEST with no parameters",
      "hex": "030b0a6c6976652f766964656f",
      "decoded": {
        "full_track_name": "live/video",
        "parameters": []
      }
    },
    {
      "id": "with-group-sequence",
      "description": "SUBSCRIBE REQUEST with GROUP_SEQUENCE parameter",
      "hex": "030e0a6c6976652f766964656f000105",
      "decoded": {
        "full_track_name": "live/video",
        "parameters": [
          {
            "type": "0x0",
            "name": "group_sequence",
            "value": "5"
          }
        ]
      }
    },
    {
      "id": "with-group-and-object-sequence",
      "description": "SUBSCRIBE REQUEST with GROUP_SEQUENCE and OBJECT_SEQUENCE parameters",
      "hex": "03110a6c6976652f766964656f000105010103",
      "decoded": {
        "full_track_name": "live/video",
        "parameters": [
          {
            "type": "0x0",
            "name": "group_sequence",
            "value": "5"
          },
          {
            "type": "0x1",
            "name": "object_sequence",
            "value": "3"
          }
        ]
      }
    },
    {
      "id": "with-authorization-info",
      "description": "SUBSCRIBE REQUEST with AUTHORIZATION_INFO parameter",
      "hex": "03140a6c6976652f766964656f02076d79746f6b656e",
      "decoded": {
        "full_track_name": "live/video",
        "parameters": [
          {
            "type": "0x2",
            "name": "authorization_info",
            "value": "mytoken"
          }
        ]
      }
    },
    {
      "id": "with-all-params",
      "description": "SUBSCRIBE REQUEST with GROUP_SEQUENCE, OBJECT_SEQUENCE, and AUTHORIZATION_INFO",
      "hex": "031a0a6c6976652f766964656f00010501010302076d79746f6b656e",
      "decoded": {
        "full_track_name": "live/video",
        "parameters": [
          {
            "type": "0x0",
            "name": "group_sequence",
            "value": "5"
          },
          {
            "type": "0x1",
            "name": "object_sequence",
            "value": "3"
          },
          {
            "type": "0x2",
            "name": "authorization_info",
            "value": "mytoken"
          }
        ]
      }
    },
    {
      "id": "object-sequence-without-group",
      "description": "SUBSCRIBE REQUEST with OBJECT_SEQUENCE but no GROUP_SEQUENCE — invalid (§6.6.1)",
      "hex": "030e0a6c6976652f766964656f010103",
      "error": "invalid_value",
      "error_detail": "OBJECT_SEQUENCE requires GROUP_SEQUENCE to be set"
    },
    {
      "id": "truncated",
      "description": "truncated SUBSCRIBE REQUEST — missing full_track_name",
      "hex": "03010a",
      "error": "incomplete",
      "error_detail": "unexpected end of input while reading full_track_name"
    }
  ]
}
