{
  "$schema": "../../../../schema/codec-vector.schema.json",
  "message_type": "subscribe_announces",
  "message_type_id": "0x11",
  "spec_section": "8.24",
  "vectors": [
    {
      "id": "single-prefix",
      "description": "SUBSCRIBE_ANNOUNCES with single-element prefix",
      "hex": "1100080101046c69766500",
      "decoded": {
        "request_id": "1",
        "track_namespace_prefix": [
          "live"
        ],
        "parameters": []
      }
    },
    {
      "id": "multi-prefix-with-auth",
      "description": "SUBSCRIBE_ANNOUNCES with multi-element prefix and auth",
      "hex": "11001e03020a636f6e666572656e636506726f6f6d34320101070300746f6b656e",
      "decoded": {
        "request_id": "3",
        "track_namespace_prefix": [
          "conference",
          "room42"
        ],
        "parameters": [
          {
            "name": "authorization_token",
            "type": "0x1",
            "value": {
              "alias_type": "3",
              "token_type": "0",
              "token_value": "746f6b656e"
            }
          }
        ]
      }
    },
    {
      "id": "truncated",
      "description": "truncated SUBSCRIBE_ANNOUNCES — missing prefix",
      "hex": "11000101",
      "error": "incomplete",
      "error_detail": "unexpected end of input while reading track_namespace_prefix"
    }
  ]
}
