{
  "$schema": "../../../../schema/codec-vector.schema.json",
  "message_type": "client_setup",
  "message_type_id": "0x40",
  "spec_section": "8.2",
  "vectors": [
    {
      "id": "minimal",
      "description": "minimal CLIENT_SETUP with draft-10 version",
      "hex": "40400a01c0000000ff00000a00",
      "decoded": {
        "supported_versions": [
          "4278190090"
        ],
        "parameters": []
      }
    },
    {
      "id": "two-versions",
      "description": "CLIENT_SETUP with two versions (draft-07, draft-10)",
      "hex": "40401202c0000000ff000009c0000000ff00000a00",
      "decoded": {
        "supported_versions": [
          "4278190089",
          "4278190090"
        ],
        "parameters": []
      }
    },
    {
      "id": "with-path-and-max-subscribe-id",
      "description": "CLIENT_SETUP with PATH and MAX_SUBSCRIBE_ID parameters",
      "hex": "40401401c0000000ff00000a0201047465737402024064",
      "decoded": {
        "supported_versions": [
          "4278190090"
        ],
        "parameters": [
          {
            "name": "path",
            "type": "0x1",
            "value": "test"
          },
          {
            "name": "max_subscribe_id",
            "type": "0x2",
            "value": "100"
          }
        ]
      }
    },
    {
      "id": "non-canonical-version-count",
      "description": "non-canonical CLIENT_SETUP: version count uses 2-byte varint for value 1",
      "hex": "40400b4001c0000000ff00000a00",
      "canonical": false,
      "decoded": {
        "supported_versions": [
          "4278190090"
        ],
        "parameters": []
      }
    },
    {
      "id": "no-versions-error",
      "description": "CLIENT_SETUP with no versions — invalid",
      "hex": "4040020000",
      "error": "invalid_value",
      "error_detail": "supported_versions must not be empty"
    },
    {
      "id": "truncated",
      "description": "truncated CLIENT_SETUP — payload shorter than declared length",
      "hex": "4040ff",
      "error": "incomplete",
      "error_detail": "unexpected end of input"
    }
  ]
}
