{
  "$schema": "../../../../schema/codec-vector.schema.json",
  "message_type": "subscribe_announces_ok",
  "message_type_id": "0x12",
  "spec_section": "7.25",
  "vectors": [
    {
      "id": "basic",
      "description": "SUBSCRIBE_ANNOUNCES_OK for single-element prefix",
      "hex": "120601046c697665",
      "decoded": {
        "track_namespace_prefix": [
          "live"
        ]
      }
    },
    {
      "id": "truncated",
      "description": "truncated SUBSCRIBE_ANNOUNCES_OK — missing prefix",
      "hex": "1200",
      "error": "incomplete",
      "error_detail": "unexpected end of input while reading track_namespace_prefix"
    }
  ]
}
