{
  "$schema": "../../../../schema/codec-vector.schema.json",
  "message_type": "publish_done",
  "message_type_id": "0x0b",
  "spec_section": "9.15",
  "vectors": [
    {
      "id": "internal-error",
      "description": "PUBLISH_DONE with INTERNAL_ERROR (0x0), stream_count=0, empty reason",
      "hex": "0b000401000000",
      "decoded": {
        "request_id": "1",
        "status_code": "0",
        "stream_count": "0",
        "reason_phrase": ""
      }
    },
    {
      "id": "track-ended",
      "description": "PUBLISH_DONE with TRACK_ENDED (0x2), stream_count=5",
      "hex": "0b000401020500",
      "decoded": {
        "request_id": "1",
        "status_code": "2",
        "stream_count": "5",
        "reason_phrase": ""
      }
    },
    {
      "id": "with-reason",
      "description": "PUBLISH_DONE with UNAUTHORIZED (0x1) and reason phrase",
      "hex": "0b00100101000c756e617574686f72697a6564",
      "decoded": {
        "request_id": "1",
        "status_code": "1",
        "stream_count": "0",
        "reason_phrase": "unauthorized"
      }
    },
    {
      "id": "truncated",
      "description": "truncated PUBLISH_DONE \u2013 missing status_code",
      "hex": "0b000401",
      "error": "incomplete",
      "error_detail": "unexpected end of input while reading status_code"
    }
  ]
}
