{
  "$schema": "../../../../schema/codec-vector.schema.json",
  "message_type": "server_setup",
  "message_type_id": "0x41",
  "spec_section": "8.2",
  "vectors": [
    {
      "id": "minimal",
      "description": "minimal SERVER_SETUP with draft-10 version",
      "hex": "404109c0000000ff00000a00",
      "decoded": {
        "selected_version": "4278190090",
        "parameters": []
      }
    },
    {
      "id": "with-max-subscribe-id",
      "description": "SERVER_SETUP with MAX_SUBSCRIBE_ID",
      "hex": "40410dc0000000ff00000a01020240c8",
      "decoded": {
        "selected_version": "4278190090",
        "parameters": [
          {
            "name": "max_subscribe_id",
            "type": "0x2",
            "value": "200"
          }
        ]
      }
    },
    {
      "id": "truncated",
      "description": "truncated SERVER_SETUP — missing parameters",
      "hex": "404108",
      "error": "incomplete",
      "error_detail": "unexpected end of input while reading parameters"
    }
  ]
}
