{
  "$schema": "../../../../schema/codec-vector.schema.json",
  "message_type": "publish_namespace",
  "message_type_id": "0x06",
  "spec_section": "9.17",
  "vectors": [
    {
      "id": "single-namespace",
      "description": "PUBLISH_NAMESPACE with single-element namespace",
      "hex": "06000f0100010a636f6e666572656e636500",
      "decoded": {
        "request_id": "1",
        "required_request_id_delta": "0",
        "track_namespace": [
          "conference"
        ],
        "parameters": []
      }
    },
    {
      "id": "multi-namespace",
      "description": "PUBLISH_NAMESPACE with multi-element namespace",
      "hex": "060010030002046c6976650673706f72747300",
      "decoded": {
        "request_id": "3",
        "required_request_id_delta": "0",
        "track_namespace": [
          "live",
          "sports"
        ],
        "parameters": []
      }
    },
    {
      "id": "with-auth-token",
      "description": "PUBLISH_NAMESPACE with AUTHORIZATION_TOKEN parameter (USE_VALUE type=0, value='pns-token')",
      "hex": "06001c0100010a636f6e666572656e636501030b0300706e732d746f6b656e",
      "decoded": {
        "request_id": "1",
        "required_request_id_delta": "0",
        "track_namespace": [
          "conference"
        ],
        "parameters": [
          {
            "name": "authorization_token",
            "type": "0x3",
            "value": {
              "alias_type": "3",
              "token_type": "0",
              "token_value": "706e732d746f6b656e"
            }
          }
        ]
      }
    },
    {
      "id": "truncated",
      "description": "truncated PUBLISH_NAMESPACE — missing namespace",
      "hex": "06000e01",
      "error": "incomplete",
      "error_detail": "unexpected end of input while reading track_namespace"
    }
  ]
}
