{
  "$schema": "../../../../schema/codec-vector.schema.json",
  "message_type": "publish_namespace_cancel",
  "message_type_id": "0x0c",
  "spec_section": "9.27",
  "vectors": [
    {
      "id": "basic",
      "description": "PUBLISH_NAMESPACE_CANCEL with INTERNAL_ERROR, empty reason",
      "hex": "0c000e010a636f6e666572656e63650000",
      "decoded": {
        "track_namespace": [
          "conference"
        ],
        "error_code": "0",
        "reason_phrase": ""
      }
    },
    {
      "id": "uninterested",
      "description": "PUBLISH_NAMESPACE_CANCEL with UNINTERESTED error",
      "hex": "0c001b02046c6976650673706f727473040c756e696e7465726573746564",
      "decoded": {
        "track_namespace": [
          "live",
          "sports"
        ],
        "error_code": "4",
        "reason_phrase": "uninterested"
      }
    },
    {
      "id": "truncated",
      "description": "truncated PUBLISH_NAMESPACE_CANCEL — missing error_code",
      "hex": "0c000c010a636f6e666572656e6365",
      "error": "incomplete",
      "error_detail": "unexpected end of input while reading error_code"
    }
  ]
}
