{
  "$schema": "../../../../schema/codec-vector.schema.json",
  "message_type": "announce_ok",
  "message_type_id": "0x07",
  "spec_section": "6.7",
  "vectors": [
    {
      "id": "simple",
      "description": "ANNOUNCE_OK for namespace 'live'",
      "hex": "0705046c697665",
      "decoded": {
        "track_namespace": "live"
      }
    },
    {
      "id": "truncated",
      "description": "truncated ANNOUNCE_OK — missing track_namespace",
      "hex": "0700",
      "error": "incomplete",
      "error_detail": "unexpected end of input while reading track_namespace"
    }
  ]
}
