{
  "$schema": "../../../../schema/codec-vector.schema.json",
  "message_type": "object",
  "message_type_id": "0x50",
  "spec_section": "6.3.3",
  "vectors": [
    {
      "id": "single-object",
      "description": "STREAM_HEADER_TRACK with one object",
      "hex": "4050010200000004deadbeef",
      "decoded": {
        "stream_type": "track",
        "subscribe_id": "1",
        "track_alias": "2",
        "object_send_order": "0",
        "objects": [
          {
            "group_id": "0",
            "object_id": "0",
            "payload_length": "4",
            "payload_hex": "deadbeef"
          }
        ]
      }
    },
    {
      "id": "two-objects",
      "description": "STREAM_HEADER_TRACK with two objects",
      "hex": "4050010200000004deadbeef000102cafe",
      "decoded": {
        "stream_type": "track",
        "subscribe_id": "1",
        "track_alias": "2",
        "object_send_order": "0",
        "objects": [
          {
            "group_id": "0",
            "object_id": "0",
            "payload_length": "4",
            "payload_hex": "deadbeef"
          },
          {
            "group_id": "0",
            "object_id": "1",
            "payload_length": "2",
            "payload_hex": "cafe"
          }
        ]
      }
    },
    {
      "id": "non-zero-send-order",
      "description": "STREAM_HEADER_TRACK with send_order=7, objects in group 3",
      "hex": "4050030107030002face030103c0ffee",
      "decoded": {
        "stream_type": "track",
        "subscribe_id": "3",
        "track_alias": "1",
        "object_send_order": "7",
        "objects": [
          {
            "group_id": "3",
            "object_id": "0",
            "payload_length": "2",
            "payload_hex": "face"
          },
          {
            "group_id": "3",
            "object_id": "1",
            "payload_length": "3",
            "payload_hex": "c0ffee"
          }
        ]
      }
    },
    {
      "id": "truncated",
      "description": "truncated STREAM_HEADER_TRACK — missing track_alias",
      "hex": "405001",
      "error": "incomplete",
      "error_detail": "unexpected end of input while reading track_alias"
    }
  ]
}
